#,Título,Tipo,Progreso,URL
1,"El caballero pesado reencarnado exiliado no tiene rival en el conocimiento del juego",MANGA,"143.00 / 160.00",https://zonatmo.nakamasweb.com/library/manga/71315/tsuihou-sareta-tensei-juukishi-wa-game-chishiki-de-musou-suru
2,"Ichi el brujo",MANGA,"- / 74.00",https://zonatmo.nakamasweb.com/library/manga/90885/madannoichi
3,"El villano rubio de la novela de la protagonista quiere ser feliz",MANHUA,"40.00 / 61.00",https://zonatmo.nakamasweb.com/library/manhua/87831/elvillanorubiodelanoveladelaprotagonistaquiereserfeliz
4,"Llevare a esta familia a la grandeza",MANHWA,"47.00 / 62.00",https://zonatmo.nakamasweb.com/library/manhwa/88247/iwillraisethisfamily
5,"Asesino de nivel dios, soy la Sombra",MANHUA,"0.00 / 97.00",https://zonatmo.nakamasweb.com/library/manhua/89191/godlevelassassinimtheshadowmanhua
6,"La Reina del Espectáculo",MANHUA,"- / 135.00",https://zonatmo.nakamasweb.com/library/manhua/62108/lareinadelespectaculo
7,"Los Secretos de la Bruja Silenciosa.",MANGA,"22.00 / 30.00",https://zonatmo.nakamasweb.com/library/manga/85396/silentwitchchinmokunomajonokakushigoto
8,"Toru ni Taranai",MANGA,"5.00 / 35.00",https://zonatmo.nakamasweb.com/library/manga/87442/torunitaranai
9,"Noa-senpai wa Tomodachi",MANGA,"9.00 / 78.00",https://zonatmo.nakamasweb.com/library/manga/78594/noa-senpai-wa-tomodachi
10,"Una forma de protegerte, cariño",MANHWA,"89.00 / 162.00",https://zonatmo.nakamasweb.com/library/manhwa/58417/unaformadeprotegertecarino
11,"GATE: Jieitai Kano Chi nite, Kaku Tatakaeri",MANGA,"92.00 / 143.60",https://zonatmo.nakamasweb.com/library/manga/8781/gatejieitaikanochinitekakutatakaeri
12,"Centuria",MANGA,"1.00 / 84.00",https://zonatmo.nakamasweb.com/library/manga/83305/centuria
13,"DE TODAS FORMAS, ES ROFAN",MANHWA,"31.00 / 136.00",https://zonatmo.nakamasweb.com/library/manhwa/64844/de-todos-modos-es-rofan
14,"Enamora al Exorcista",MANGA,"1.00 / 108.00",https://zonatmo.nakamasweb.com/library/manga/68042/make-the-exorcist-fall-in-love
15,"Otaku ni Yasashii Gyaru wa Inai!?",MANGA,"- / 317.00",https://zonatmo.nakamasweb.com/library/manga/66472/otakuniyasashiigalwainai
16,"Demon X Angel - No Pueden Llevarse Bien",MANHUA,"- / 134.00",https://zonatmo.nakamasweb.com/library/manhua/55925/demon-x-angel-no-pueden-llevarse-bien
17,"Sentai Daishikkaku",MANGA,"95.00 / 207.00",https://zonatmo.nakamasweb.com/library/manga/57085/sentaidaishikkaku
18,"¡Vence al Emperador Dragón en esta ronda, Señorita!",MANGA,"13.00 / 39.00",https://zonatmo.nakamasweb.com/library/manga/52177/yarinaoshi-reijou-ha-ryuu-mikado-heika-wo-kouryakuchuu
19,"Gestión de las relaciones laborales",MANHWA,"5.00 / 30.00",https://zonatmo.nakamasweb.com/library/manhwa/87962/gestiondelasrelacioneslaborales
20," Botsuraku Yotei no Kizoku dakedo, Hima datta kara Mahou wo Kiwamete Mita",MANGA,"7.10 / 30.20",https://zonatmo.nakamasweb.com/library/manga/57596/botsurakuyoteinokizokudakedohimadattakaramahouwokiwametemitaatcomic
21,"Mi Esposa Es De Hace Mil Años",MANHUA,"- /456.00",https://zonatmo.nakamasweb.com/library/manhua/66762/miesposaesdehacemilanos
22,"Kogeki Ryoku Kyoku Buri No Saikyo Majutsu Shi Kinryoku Chi 9999 No Daiken Shi, Tensei Shite Ni Dome No Jinsei Wo Ayumu",MANGA,"1.00 / 32.00",https://zonatmo.nakamasweb.com/library/manga/64299/kougekiryokukyokuburinosaikyoumajutsushikinryokuchi9999nodaikenshitenseishitenidomenojinseiwoayumu
23,"Devilchi",MANGA,"- / 128.00",https://zonatmo.nakamasweb.com/library/manga/24373/devilchi
24,"Me desperté pilotando la nave espacial más poderosa, así que me hice mercenario espacial",MANGA,"1.00 / 49.20",https://zonatmo.nakamasweb.com/library/manga/47749/mezametarasaikyousoubitouchuusenmochidattanodeikkodatemezashiteyouheitoshitejiyuuniikitai
25,"Youjo Senki",MANGA,"54.00 / 114.00",https://zonatmo.nakamasweb.com/library/manga/16022/youjosenki
26,"A Rank Party wo Ridatsu Shita Ore wa, Moto Oshiego Tachi to Meikyuu Shinbu wo Mezasu",MANGA,"40.00 / 48.00",https://zonatmo.nakamasweb.com/library/manga/62508/arankpartyworidatsushitaorewamotooshiegotachitomeikyuushinbuwomezasu
27,"¿Por qué estás tan obsesionado con rechazar el afecto?",MANHWA,"56.00 / 76.00",https://zonatmo.nakamasweb.com/library/manhwa/85433/obsessedwithshuelina
28,"Me Convertiré en una Villana que pasará a la Historia, Mientras más Villana sea, más se fijará el Príncipe en mí.",MANGA,"- / 28.00",https://zonatmo.nakamasweb.com/library/manga/49866/rekishininokoruakujoninaruzoakuyakureijouninaruhodooujinodekiaiwakasokusuruyoudesu
29,"Yo Era La Verdadera Dueña De Elheim",MANHWA,"34.00 / 58.00",https://zonatmo.nakamasweb.com/library/manhwa/84532/yoeralaverdaderaduenadeelheim
30,"El caso de un otaku de Animes Domingueros, Reencarnado como el Villano y Aplastando sus Banderas de Destrucción",MANGA,"- / 14.00",https://zonatmo.nakamasweb.com/library/manga/80680/nichiasa-suki-no-otaku-ga-akuyaku-seito-ni-tenseishita-kekka-hametsu-flag-ga-houkaishiteiku-ken-ni-tsuite
31,"Cuando levanté la barrera más fuerte del país, se volvió demasiado pacífico y me desterraron. ¿Sabían que esa barrera no es permanente, verdad?",MANGA,"7.00 / 10.10",https://zonatmo.nakamasweb.com/library/manga/83041/kuninisaikyounobarrierwohattaraheiwaninarisugitetsuihousaremashitaorenomahougayabasugitebijotomazokunikakomarerundaga
32,"La hermana malvada esconde su riqueza",MANHWA,"30.00 / 35.00",https://zonatmo.nakamasweb.com/library/manhwa/87636/thevillainousoldersisterhidesherwealth
33,"El Rey Demonio invadido por héroes",MANHWA,"6.00 / 7.00",https://zonatmo.nakamasweb.com/library/manhwa/90760/thedemonkinghastoomanyheroesmanhwa
34,"El objeto extraño era yo",MANHWA,"1.00 / 31.00",https://zonatmo.nakamasweb.com/library/manhwa/86887/destinedtobeanoutcast
35,"Jugador número 1",MANHUA,"2.00 / 30.00",https://zonatmo.nakamasweb.com/library/manhua/88391/jugadornumero1
36,"La voluntad de supervivencia del villano",MANHWA,"34.00 / 43.00",https://zonatmo.nakamasweb.com/library/manhwa/88061/thevillainssurvivalroute
37,"Lilia Embarazada El Fin del Mundo",MANGA,"4.00 / 38.50",https://zonatmo.nakamasweb.com/library/manga/76948/liliapregnanttheworldend
38,"Soy el Dios de los Goblins",MANHUA,"36.00 / 79.00",https://zonatmo.nakamasweb.com/library/manhua/84954/fromgoblintogoblingod
39,"It's the first time they love me",MANHWA,"- / 75.00",https://zonatmo.nakamasweb.com/library/manhwa/80924/eslaprimeravezquemeaman
40,"Reencarnado en un genio prodigio de una familia prestigiosa",MANHWA,"33.00 / 39.00",https://zonatmo.nakamasweb.com/library/manhwa/86154/rebornastheoverpoweredgeniuslord
41,"Héroe x Reina Demonio",MANHUA,"110.00 / 160.00",https://zonatmo.nakamasweb.com/library/manhua/79716/heroe-x-reina-demonio
42,"Por Mi Hermano, Conquistaré Al Protagonista Masculino",MANHWA,"39.00 / 82.00",https://zonatmo.nakamasweb.com/library/manhwa/77441/pormihermanoconquistarealprotagonistamasculinomanwha
43,"Mi prometido me engañó con la protagonista",MANHWA,"66.00 / 81.00",https://zonatmo.nakamasweb.com/library/manhwa/79326/miprometidomeenganoconlaprotagonista
44,"Reencarnado ",MANHWA,"9.00 / 19.00",https://zonatmo.nakamasweb.com/library/manhwa/81413/reencarnado
45,"El asesino de la luna a la deriva",MANHWA,"71.00 / 75.00",https://zonatmo.nakamasweb.com/library/manhwa/70933/elasesinodelalunaaladeriva
46,"Amigo de la infancia Zenith",MANHWA,"30.00 / 52.00",https://zonatmo.nakamasweb.com/library/manhwa/85248/amigodelainfanciazenith
47,"Mas que hermanos",MANHWA,"14.00 / 89.50",https://zonatmo.nakamasweb.com/library/manhwa/71782/mas-que-hermanos
48,"Las conspiraciones del mercenario regresado",MANHWA,"- / 32.00",https://zonatmo.nakamasweb.com/library/manhwa/86026/theregressedmercenaryhasaplan
49,"El anciano que se dio cuenta que tenia un talento natural a los 60 años",MANGA,"2.00 / 20.00",https://zonatmo.nakamasweb.com/library/manga/79921/el-anciano-que-se-dio-cuenta-de-que-tenia-un-talento-natural-a-los-60-anos
50,"Regresión del bastardo del clan de la espada",MANHWA,"3.00 / 56.00",https://zonatmo.nakamasweb.com/library/manhwa/86436/regressingasthereincarnatedbastardoftheswordclan
51,"Dome Al Perro Corrompido Del Palacio",MANHWA,"2.00 / 43.00",https://zonatmo.nakamasweb.com/library/manhwa/85680/domealperrocorrompidodelpalacio
52,"El Rey Demonio III",MANHUA,"201.00 / 371.00",https://zonatmo.nakamasweb.com/library/manhua/45600/the-demon-king-who-lost-his-job
53,"Ella es la hija perdida del emperador",MANHWA,"15.00 / 36.00",https://zonatmo.nakamasweb.com/library/manhwa/83109/imtheemperorslonglostdaughter
54,"Sólo yo puedo hablar el antiguo lenguaje de la magia",MANHWA,"- / 62.00",https://zonatmo.nakamasweb.com/library/manhwa/77429/solo-yo-puedo-hablar-el-antiguo-lenguaje-de-la-magia
55,"Para ayudarte a entender lo que significa ser tú",MANHWA,"12.00 / 165.00",https://zonatmo.nakamasweb.com/library/manhwa/57882/losignificasertu
56,"Domestiqué al protagonista masculino que intentó matarme",MANHWA,"0.00 / 50.00",https://zonatmo.nakamasweb.com/library/manhwa/74860/itamedthemaleleadwhotriedtokillme
57,"Malos pensamientos",MANHWA,"1.00 / 61.00",https://zonatmo.nakamasweb.com/library/manhwa/69501/malos-pensamientos
58,"Katekyo Hitman Reborn!",MANGA,"5.00 / 409.00",https://zonatmo.nakamasweb.com/library/manga/2522/katekyo-hitman-reborn